transcript,url,WC,Analytic,Clout,Authentic,Tone,WPS,Sixltr,Dic,function,pronoun,ppron,i,we,you,shehe,they,ipron,article,prep,auxverb,adverb,conj,negate,verb,adj,compare,interrog,number,quant,affect,posemo,negemo,anx,anger,sad,social,family,friend,female,male,cogproc,insight,cause,discrep,tentat,certain,differ,percept,see,hear,feel,bio,body,health,sexual,ingest,drives,affiliation,achieve,power,reward,risk,focuspast,focuspresent,focusfuture,relativ,motion,space,time,work,leisure,home,money,relig,death,informal,swear,netspeak,assent,nonflu,filler,AllPunc,Period,Comma,Colon,SemiC,QMark,Exclam,Dash,Quote,Apostro,Parenth,OtherP,comments,description,duration,event,film_date,languages,main_speaker,name,num_speaker,published_date,ratings,related_talks,speaker_occupation,tags,title,views
"(Music)[Sanskrit] This is an ode to the mother goddess, that most of us in India learn when we are children. I learned it when I was four at my mother's knee. That year she introduced me to dance, and thus began my tryst with classical dance. Since then — it's been four decades now — I've trained with the best in the field, performed across the globe, taught young and old alike, created, collaborated, choreographed, and wove a rich tapestry of artistry, achievement and awards. The crowning glory was in 2007, when I received this country's fourth highest civilian award, the Padma Shri, for my contribution to art.(Applause)But nothing, nothing prepared me for what I was to hear on the first of July 2008. I heard the word ""carcinoma."" Yes, breast cancer. As I sat dumbstruck in my doctor's office, I heard other words: ""cancer,"" ""stage,"" ""grade."" Until then, Cancer was the zodiac sign of my friend, stage was what I performed on, and grades were what I got in school. That day, I realized I had an unwelcome, uninvited, new life partner. As a dancer, I know the nine rasas or the navarasas: anger, valor, disgust, humor and fear. I thought I knew what fear was. That day, I learned what fear was.Overcome with the enormity of it all and the complete feeling of loss of control, I shed copious tears and asked my dear husband, Jayant. I said, ""Is this it? Is this the end of the road? Is this the end of my dance?"" And he, the positive soul that he is, said, ""No, this is just a hiatus, a hiatus during the treatment, and you'll get back to doing what you do best.""I realized then that I, who thought I had complete control of my life, had control of only three things: My thought, my mind — the images that these thoughts created — and the action that derived from it. So here I was wallowing in a vortex of emotions and depression and what have you, with the enormity of the situation, wanting to go to a place of healing, health and happiness. I wanted to go from where I was to where I wanted to be, for which I needed something. I needed something that would pull me out of all this. So I dried my tears, and I declared to the world at large ... I said, ""Cancer's only one page in my life, and I will not allow this page to impact the rest of my life.""I also declared to the world at large that I would ride it out, and I would not allow cancer to ride me. But to go from where I was to where I wanted to be, I needed something. I needed an anchor, an image, a peg to peg this process on, so that I could go from there. And I found that in my dance, my dance, my strength, my energy, my passion, my very life breath. But it wasn't easy. Believe me, it definitely wasn't easy. How do you keep cheer when you go from beautiful to bald in three days? How do you not despair when, with the body ravaged by chemotherapy, climbing a mere flight of stairs was sheer torture, that to someone like me who could dance for three hours? How do you not get overwhelmed by the despair and the misery of it all? All I wanted to do was curl up and weep. But I kept telling myself fear and tears are options I did not have.So I would drag myself into my dance studio — body, mind and spirit — every day into my dance studio, and learn everything I learned when I was four, all over again, reworked, relearned, regrouped. It was excruciatingly painful, but I did it. Difficult. I focused on my mudras, on the imagery of my dance, on the poetry and the metaphor and the philosophy of the dance itself. And slowly, I moved out of that miserable state of mind.But I needed something else. I needed something to go that extra mile, and I found it in that metaphor which I had learned from my mother when I was four. The metaphor of Mahishasura Mardhini, of Durga. Durga, the mother goddess, the fearless one, created by the pantheon of Hindu gods. Durga, resplendent, bedecked, beautiful, her 18 arms ready for warfare, as she rode astride her lion into the battlefield to destroy Mahishasur. Durga, the epitome of creative feminine energy, or shakti. Durga, the fearless one. I made that image of Durga and her every attribute, her every nuance, my very own.Powered by the symbology of a myth and the passion of my training, I brought laser-sharp focus into my dance, laser-sharp focus to such an extent that I danced a few weeks after surgery. I danced through chemo and radiation cycles, much to the dismay of my oncologist. I danced between chemo and radiation cycles and badgered him to fit it to my performing dance schedule. What I had done is I had tuned out of cancer and tuned into my dance. Yes, cancer has just been one page in my life.My story is a story of overcoming setbacks, obstacles and challenges that life throws at you. My story is the power of thought. My story is the power of choice. It's the power of focus. It's the power of bringing ourselves to the attention of something that so animates you, so moves you, that something even like cancer becomes insignificant. My story is the power of a metaphor. It's the power of an image. Mine was that of Durga, Durga the fearless one. She was also called Simhanandini, the one who rode the lion.As I ride out, as I ride my own inner strength, my own inner resilience, armed as I am with what medication can provide and continue treatment, as I ride out into the battlefield of cancer, asking my rogue cells to behave, I want to be known not as a cancer survivor, but as a cancer conqueror.I present to you an excerpt of that work ""Simhanandini.""(Applause)(Music)(Applause)","https://www.ted.com/talks/ananda_shankar_jayant_fights_cancer_with_a_dance
",1038,58.56,29.47,76.02,34.11,18.87,16.09,87.67,57.23,20.52,13.29,10.98,0.29,1.06,0.96,0,7.23,7.23,14.16,6.94,3.56,7.23,1.06,13.97,3.08,1.64,2.7,1.83,1.16,5.78,3.08,2.6,0.67,0.58,1.06,7.13,0.48,0.29,1.35,0.39,9.73,2.22,1.54,1.73,1.16,1.45,1.83,1.93,0.67,0.77,0.48,3.18,0.67,2.31,0.29,0,8,2.31,1.83,3.47,1.16,0.19,7.13,5.3,0.58,12.91,3.85,5.39,3.95,2.41,2.02,0.29,0.1,0.48,0.1,0.19,0,0,0.19,0,0,20.62,5.88,9.83,0.29,0,0.58,0,0.19,1.54,1.16,0.96,0.19,155,"Renowned classical Indian dancer Ananda Shankar Jayant was diagnosed with cancer in 2008. She tells her personal story of not only facing the disease but dancing through it, and gives a performance revealing the metaphor of strength that helped her do it. ",967,TEDIndia 2009,1257984000,31,Ananda Shankar Jayant,Ananda Shankar Jayant: Fighting cancer with dance,1,1276851600,"[{'id': 23, 'name': 'Jaw-dropping', 'count': 70}, {'id': 3, 'name': 'Courageous', 'count': 296}, {'id': 10, 'name': 'Inspiring', 'count': 397}, {'id': 1, 'name': 'Beautiful', 'count': 273}, {'id': 24, 'name': 'Persuasive', 'count': 32}, {'id': 8, 'name': 'Informative', 'count': 19}, {'id': 22, 'name': 'Fascinating', 'count': 84}, {'id': 9, 'name': 'Ingenious', 'count': 13}, {'id': 25, 'name': 'OK', 'count': 26}, {'id': 21, 'name': 'Unconvincing', 'count': 12}, {'id': 7, 'name': 'Funny', 'count': 3}, {'id': 2, 'name': 'Confusing', 'count': 5}, {'id': 26, 'name': 'Obnoxious', 'count': 23}, {'id': 11, 'name': 'Longwinded', 'count': 18}]","[{'id': 688, 'hero': 'https://pe.tedcdn.com/images/ted/132434_800x600.jpg', 'speaker': 'Mallika Sarabhai', 'title': 'Dance to change the world', 'duration': 1012, 'slug': 'mallika_sarabhai', 'viewed_count': 481836}, {'id': 859, 'hero': 'https://pe.tedcdn.com/images/ted/055b61a8ce3f799846f9dbdecbe2c30d0d0726bd_1600x1200.jpg', 'speaker': 'William Li', 'title': 'Can we eat to starve cancer?', 'duration': 1202, 'slug': 'william_li', 'viewed_count': 4149066}, {'id': 761, 'hero': 'https://pe.tedcdn.com/images/ted/146612_800x600.jpg', 'speaker': 'David Agus', 'title': 'A new strategy in the war on cancer', 'duration': 1424, 'slug': 'david_agus_a_new_strategy_in_the_war_on_cancer', 'viewed_count': 696320}, {'id': 2589, 'hero': 'https://pe.tedcdn.com/images/ted/7e8a2533ffe6a7a79ff0c4e1e166881cc3fddc4e_2880x1620.jpg', 'speaker': 'Camille A. Brown', 'title': 'A visual history of social dance in 25 moves', 'duration': 276, 'slug': 'camille_a_brown_a_visual_history_of_social_dance_in_25_moves', 'viewed_count': 778666}, {'id': 2602, 'hero': 'https://pe.tedcdn.com/images/ted/ea356198f12112590b2bc014f840301f33218d6f_2880x1620.jpg', 'speaker': 'Trevor Copp and Jeff Fox', 'title': 'Ballroom dance that breaks gender roles', 'duration': 933, 'slug': 'trevor_copp_jeff_fox_ballroom_dance_that_breaks_gender_roles', 'viewed_count': 570951}, {'id': 1235, 'hero': 'https://pe.tedcdn.com/images/ted/57c5ee2c30e9eb479a9f16ac1b7aaee07b639f39_800x600.jpg', 'speaker': 'Danielle de Niese', 'title': 'A flirtatious aria', 'duration': 355, 'slug': 'danielle_de_niese_a_flirtatious_aria', 'viewed_count': 787084}]",Dancer and choreographer,"['cancer', 'dance', 'music', 'performance', 'personal growth', 'storytelling']",Fighting cancer with dance,587639
"I am a cultural omnivore, one whose daily commute is made possible by attachment to an iPod — an iPod that contains Wagner and Mozart, pop diva Christina Aguilera, country singer Josh Turner, gangsta rap artist Kirk Franklin, concerti, symphonies and more and more. I'm a voracious reader, a reader who deals with Ian McEwan down to Stephanie Meyer. I have read the Twilight tetralogy. And one who lives for my home theater, a home theater where I devour DVDs, video on demand and a lot of television. For me, ""Law & Order: SVU,"" Tina Fey and ""30 Rock"" and ""Judge Judy"" — ""The people are real, the cases are real, the rulings are final.""(Laughter)Now, I'm convinced a lot of you probably share my passions, especially my passion for ""Judge Judy,"" and you'd fight anybody who attempted to take her away from us, but I'm a little less convinced that you share the central passion of my life, a passion for the live professional performing arts, performing arts that represent the orchestral repertoire, yes, but jazz as well, modern dance, opera, theater and more and more and more.Frankly, it's a sector that many of us who work in the field worry is being endangered and possibly dismantled by technology. While we initially heralded the Internet as the fantastic new marketing device that was going to solve all our problems, we now realize that the Internet is, if anything, too effective in that regard. Depending on who you read, an arts organization or an artist, who tries to attract the attention of a potential single ticket buyer, now competes with between three and 5,000 different marketing messages a typical citizen sees every single day. We now know, in fact, that technology is our biggest competitor for leisure time. Five years ago, Gen Xers spent 20.7 hours online and TV, the majority on TV. Gen Yers spent even more — 23.8 hours, the majority online. And now, a typical university-entering student arrives at college already having spent 20,000 hours online and an additional 10,000 hours playing video games — a stark reminder that we operate in a cultural context where video games now outsell music and movie recordings combined.Moreover, we're afraid that technology has altered our very assumptions of cultural consumption. Thanks to the Internet, we believe we can get anything we want whenever we want it, delivered to our own doorstep. We can shop at three in the morning or eight at night, ordering jeans tailor-made for our unique body types. Expectations of personalization and customization that the live performing arts — which have set curtain times, set venues, attendant inconveniences of travel, parking and the like — simply cannot meet. And we're all acutely aware: what's it going to mean in the future when we ask someone to pay a hundred dollars for a symphony, opera or ballet ticket, when that cultural consumer is used to downloading on the internet 24 hours a day for 99 cents a song or for free? These are enormous questions for those of us that work in this terrain. But as particular as they feel to us, we know we're not alone.All of us are engaged in a seismic, fundamental realignment of culture and communications, a realignment that is shaking and decimating the newspaper industry, the magazine industry, the book and publishing industry and more. Saddled in the performing arts as we are, by antiquated union agreements that inhibit and often prohibit mechanical reproduction and streaming, locked into large facilities that were designed to ossify the ideal relationship between artist and audience most appropriate to the 19th century and locked into a business model dependent on high ticket revenues, where we charge exorbitant prices. Many of us shudder in the wake of the collapse of Tower Records and ask ourselves, ""Are we next?"" Everyone I talk to in performing arts resonates to the words of Adrienne Rich, who, in ""Dreams of a Common Language,"" wrote, ""We are out in a country that has no language, no laws. Whatever we do together is pure invention. The maps they gave us are out of date by years."" And for those of you who love the arts, aren't you glad you invited me here to brighten your day?(Laughter)(Applause)Now, rather than saying that we're on the brink of our own annihilation, I prefer to believe that we are engaged in a fundamental reformation, a reformation like the religious Reformation of the 16th century. The arts reformation, like the religious Reformation, is spurred in part by technology, with indeed, the printing press really leading the charge on the religious Reformation. Both reformations were predicated on fractious discussion, internal self-doubt and massive realignment of antiquated business models. And at heart, both reformations, I think, were asking the questions: who's entitled to practice? How are they entitled to practice? And indeed, do we need anyone to intermediate for us in order to have an experience with a spiritual divine?Chris Anderson, someone I trust you all know, editor in chief of Wired magazine and author of The Long Tail, really was the first, for me, to nail a lot of this. He wrote a long time ago, you know, thanks to the invention of the Internet, web technology, minicams and more, the means of artistic production have been democratized for the first time in all of human history. In the 1930s, if any of you wanted to make a movie, you had to work for Warner Brothers or RKO, because who could afford a movie set and lighting equipment and editing equipment and scoring, and more? And now who in this room doesn't know a 14 year-old hard at work on her second, third, or fourth movie?(Laughter)Similarly, the means of artistic distribution have been democratized for the first time in human history. Again, in the '30s, Warner Brothers, RKO did that for you. Now, go to YouTube, Facebook; you have worldwide distribution without leaving the privacy of your own bedroom.This double impact is occasioning a massive redefinition of the cultural market, a time when anyone is a potential author. Frankly, what we're seeing now in this environment is a massive time, when the entire world is changing as we move from a time when audience numbers are plummeting. But the number of arts participants, people who write poetry, who sing songs, who perform in church choirs, is exploding beyond our wildest imaginations. This group, others have called the pro-ams, amateur artists doing work at a professional level. You see them on YouTube, in dance competitions, film festivals and more. They are radically expanding our notions of the potential of an aesthetic vocabulary, while they are challenging and undermining the cultural autonomy of our traditional institutions. Ultimately, we now live in a world defined not by consumption, but by participation.But I want to be clear, just as the religious Reformation did not spell the end to the formal Church or to the priesthood; I believe that our artistic institutions will continue to have importance. They currently are the best opportunities for artists to have lives of economic dignity — not opulence, of dignity. And they are the places where artists who deserve and want to work at a certain scale of resources will find a home. But to view them as synonymous with the entirety of the arts community is, by far, too shortsighted. And indeed, while we've tended to polarize the amateur from the professional, the single most exciting development in the last five to 10 years has been the rise of the professional hybrid artist, the professional artist who works, not primarily in the concert hall or on the stage; but most frequently around women's rights, or human rights, or on global warming issues or AIDS relief for more — not out of economic necessity, but out of a deep, organic conviction that the work that she or he is called to do cannot be accomplished in the traditional hermetic arts environment.Today's dance world is not defined solely by the Royal Winnipeg Ballet or the National Ballet of Canada, but by Liz Lerman's Dance Exchange — a multi-generational, professional dance company, whose dancers range in age from 18 to 82, and who work with genomic scientists to embody the DNA strand and with nuclear physicists at CERN. Today's professional theater community is defined, not only the Shaw and Stratford Festivals, but by the Cornerstone Theater of Los Angeles — a collective of artists that after 9/11, brought together 10 different religious communities — the Baha'i, the Catholic, the Muslim, the Jewish, even the Native American and the gay and lesbian communities of faith, helping them create their own individual plays and one massive play, where they explored the differences in their faith and found commonality as an important first step toward cross-community healing. Today's performers, like Rhodessa Jones, work in women's prisons, helping women prisoners articulate the pain of incarceration, while today's playwrights and directors work with youth gangs to find alternate channels to violence and more and more and more. And indeed, I think, rather than being annihilated, the performing arts are poised on the brink of a time when we will be more important than we have ever been.You know, we've said for a long time, we are critical to the health of the economic communities in your town. And absolutely — I hope you know that every dollar spent on a performing arts ticket in a community generates five to seven additional dollars for the local economy, dollars spent in restaurants or on parking, at the fabric stores where we buy fabric for costumes, the piano tuner who tunes the instruments, and more. But the arts are going to be more important to economies as we go forward, especially in industries we can't even imagine yet, just as they have been central to the iPod and the computer game industries, which few, if any of us, could have foreseen 10 to 15 years ago. Business leadership will depend more and more on emotional intelligence, the ability to listen deeply, to have empathy, to articulate change, to motivate others — the very capacities that the arts cultivate with every encounter.Especially now, as we all must confront the fallacy of a market-only orientation, uninformed by social conscience; we must seize and celebrate the power of the arts to shape our individual and national characters, and especially characters of the young people, who all too often are subjected to bombardment of sensation, rather than digested experience. Ultimately, especially now in this world, where we live in a context of regressive and onerous immigration laws, in reality TV that thrives on humiliation, and in a context of analysis, where the thing we hear most repeatedly, day in, day out in the United States, in every train station, every bus station, every plane station is, ""Ladies and gentlemen, please report any suspicious behavior or suspicious individuals to the authorities nearest to you,"" when all of these ways we are encouraged to view our fellow human being with hostility and fear and contempt and suspicion.The arts, whatever they do, whenever they call us together, invite us to look at our fellow human being with generosity and curiosity. God knows, if we ever needed that capacity in human history, we need it now. You know, we're bound together, not, I think by technology, entertainment and design, but by common cause. We work to promote healthy vibrant societies, to ameliorate human suffering, to promote a more thoughtful, substantive, empathic world order.I salute all of you as activists in that quest and urge you to embrace and hold dear the arts in your work, whatever your purpose may be. I promise you the hand of the Doris Duke Charitable Foundation is stretched out in friendship for now and years to come. And I thank you for your kindness and your patience in listening to me this afternoon.Thank you, and Godspeed.","https://www.ted.com/talks/ben_cameron_tedxyyc
",2011,86.64,87.87,37.23,63.48,36.56,24.71,84.98,49.28,11.39,7.21,1.34,3.33,1.49,0.25,0.8,4.18,8.6,14.27,5.37,3.83,6.86,0.85,10.54,4.97,2.83,2.29,2.09,3.03,4.28,3.13,1.14,0.5,0.3,0.1,12.03,0.1,0.25,0.4,0.4,10.09,2.09,0.94,1.19,2.59,2.19,2.98,1.94,0.5,0.99,0.35,1.29,0.25,0.65,0.35,0.1,9.95,5.42,2.19,2.24,0.5,0.3,1.89,9.35,0.75,14.07,1.34,7.61,5.02,4.53,4.87,0.35,1.69,0.8,0,0.35,0,0,0.3,0.05,0,16.56,3.08,9.6,0.15,0.2,0.4,0,0.4,0.9,1.34,0.4,0.1,97,"How can the magic of live theater, live music, live dance compete with the always-on Internet? Ben Cameron offers a bold look forward to a world where live arts matter more than ever -- to link humans together at a primal level of shared experience.",764,TEDxYYC,1267142400,27,Ben Cameron,Ben Cameron: Why the live arts matter,1,1284107880,"[{'id': 10, 'name': 'Inspiring', 'count': 295}, {'id': 8, 'name': 'Informative', 'count': 74}, {'id': 22, 'name': 'Fascinating', 'count': 66}, {'id': 24, 'name': 'Persuasive', 'count': 172}, {'id': 3, 'name': 'Courageous', 'count': 79}, {'id': 23, 'name': 'Jaw-dropping', 'count': 37}, {'id': 25, 'name': 'OK', 'count': 40}, {'id': 11, 'name': 'Longwinded', 'count': 26}, {'id': 21, 'name': 'Unconvincing', 'count': 27}, {'id': 26, 'name': 'Obnoxious', 'count': 21}, {'id': 1, 'name': 'Beautiful', 'count': 41}, {'id': 7, 'name': 'Funny', 'count': 8}, {'id': 2, 'name': 'Confusing', 'count': 14}, {'id': 9, 'name': 'Ingenious', 'count': 19}]","[{'id': 60, 'hero': 'https://pe.tedcdn.com/images/ted/b538bc5fb569cc2a617db5ddc1e42935bceb00c6_2880x1620.jpg', 'speaker': 'Anna Deavere Smith', 'title': 'Four American characters', 'duration': 1385, 'slug': 'anna_deavere_smith_s_american_character', 'viewed_count': 978840}, {'id': 1989, 'hero': 'https://pe.tedcdn.com/images/ted/974f4028e20390247c51cca4cbe5fbdbc3eab9e0_1600x1200.jpg', 'speaker': 'Sarah Jones', 'title': 'What does the future hold? 11 characters offer quirky answers', 'duration': 1116, 'slug': 'sarah_jones_what_does_the_future_hold_11_characters_offer_quirky_answers', 'viewed_count': 1506035}, {'id': 1108, 'hero': 'https://pe.tedcdn.com/images/ted/d668e6a644727df5d286001007b40dfd3a12936d_800x600.jpg', 'speaker': 'Handspring Puppet Co.', 'title': 'The genius puppetry behind War Horse', 'duration': 1091, 'slug': 'handpring_puppet_co_the_genius_puppetry_behind_war_horse', 'viewed_count': 1530706}, {'id': 1653, 'hero': 'https://pe.tedcdn.com/images/ted/e562bc9bf7daf7d4f06450eff3d5af17a5e873f8_2880x1620.jpg', 'speaker': 'Young-ha Kim', 'title': 'Be an artist, right now!', 'duration': 1017, 'slug': 'young_ha_kim_be_an_artist_right_now', 'viewed_count': 1841682}, {'id': 1169, 'hero': 'https://pe.tedcdn.com/images/ted/f553f02f7c6b89f37c883ba4e4805f560f6fb811_800x600.jpg', 'speaker': 'Shea Hembrey', 'title': 'How I became 100 artists', 'duration': 1008, 'slug': 'shea_hembrey_how_i_became_100_artists', 'viewed_count': 1486877}, {'id': 1552, 'hero': 'https://pe.tedcdn.com/images/ted/3c87fcc96f236d805b48c0308db5f3e7f144545b_1600x1200.jpg', 'speaker': 'David Binder', 'title': 'The arts festival revolution', 'duration': 546, 'slug': 'david_binder_the_arts_festival_revolution', 'viewed_count': 674283}]",Arts administrator,"['TEDx', 'education', 'entertainment', 'music', 'performance', 'performance art', 'theater']",Why the live arts matter,497710
