transcript,url,WC,Analytic,Clout,Authentic,Tone,WPS,Sixltr,Dic,function,pronoun,ppron,i,we,you,shehe,they,ipron,article,prep,auxverb,adverb,conj,negate,verb,adj,compare,interrog,number,quant,affect,posemo,negemo,anx,anger,sad,social,family,friend,female,male,cogproc,insight,cause,discrep,tentat,certain,differ,percept,see,hear,feel,bio,body,health,sexual,ingest,drives,affiliation,achieve,power,reward,risk,focuspast,focuspresent,focusfuture,relativ,motion,space,time,work,leisure,home,money,relig,death,informal,swear,netspeak,assent,nonflu,filler,AllPunc,Period,Comma,Colon,SemiC,QMark,Exclam,Dash,Quote,Apostro,Parenth,OtherP,comments,description,duration,event,film_date,languages,main_speaker,name,num_speaker,published_date,ratings,related_talks,speaker_occupation,tags,title,views
"(Music)(Music ends)(Applause)(Applause ends)Hi, everyone. I'm Sirena. I'm 11 years old and from Connecticut. (Audience cheers)(Applause)Well, I'm not really sure why I'm here.(Laughter)I mean, what does this have to do with technology, entertainment and design? Well, I count my iPod, cellphone and computer as technology, but this has nothing to do with that.So I did a little research on it. Well, this is what I found. Of course, I hope I can memorize it.(Clears throat)The violin is made of a wood box and four metal strings. By pulling a string, it vibrates and produces a sound wave, which passes through a piece of wood called a bridge, and goes down to the wood box and gets amplified, but ... let me think.(Laughter)Placing your finger at different places on the fingerboard changes the string length, and that changes the frequency of the sound wave. (Sighs) Oh, my gosh!(Laughter)OK, this is sort of technology, but I can call it a 16th-century technology. But actually, the most fascinating thing that I found was that even the audio system or wave transmission nowadays are still based on the same principle of producing and projecting sound. Isn't that cool?(Laughter)(Applause)Design — I love its design. I remember when I was little, my mom asked me, ""Would you like to play the violin or the piano?"" I looked at that giant monster and said to myself — ""I am not going to lock myself on that bench the whole day!""(Laughter)This is small and lightweight. I can play from standing, sitting or walking. And, you know what? The best of all is that if I don't want to practice, (Whispering) I can hide it.(Laughter)The violin is very beautiful. Some people relate it as the shape of a lady. But whether you like it or not, it's been so for more than 400 years, unlike modern stuff [that] easily looks dated. But I think it's very personal and unique that, although each violin looks pretty similar, no two violins sound the same — even from the same maker or based on the same model.Entertainment — I love the entertainment. But actually, the instrument itself isn't very entertaining. I mean, when I first got my violin and tried to play around on it, it was actually really bad, because it didn't sound the way I'd heard from other kids — it was so horrible and so scratchy. So, it wasn't entertaining at all. But besides, my brother found this very funny: Yuk! Yuk! Yuk!(Laughter)A few years later, I heard a joke about the greatest violinist, Jascha Heifetz. After Mr. Heifetz's concert, a lady came over and complimented him: ""Oh, Mr. Heifetz, your violin sounded so great tonight!"" And Mr. Heifetz was a very cool person, so he picked up his violin and said, ""Funny — I don't hear anything.""(Laughter)Now I realize that as the musician, we human beings, with our great mind, artistic heart and skill, can change this 16th-century technology and a legendary design to a wonderful entertainment. Now I know why I'm here.(Music)(Music ends)(Applause)At first, I thought I was just going to be here to perform, but unexpectedly, I learned and enjoyed much more. But ... although some of the talks were quite up there for me.(Laughter)Like the multi-dimension stuff. I mean, honestly, I'd be happy enough if I could actually get my two dimensions correct in school.(Laughter)But actually, the most impressive thing to me is that — well, actually, I would also like to say this for all children is to say thank you to all adults, for actually caring for us a lot, and to make our future world much better. Thank you.(Applause)(Music)(Music ends)(Applause)(Applause ends)(Music)(Music ends)(Applause)","https://www.ted.com/talks/sirena_huang_dazzles_on_violin
",646,37.56,23.35,75.98,99,19.58,17.8,87.62,53.56,17.03,9.75,7.59,0.62,1.08,0.46,0,7.28,6.35,10.06,7.74,6.5,8.82,1.7,15.17,6.19,3.41,1.39,1.08,2.63,8.82,8.2,0.46,0.15,0,0.15,6.66,0.31,0,0.46,0.62,14.55,2.48,2.17,1.24,2.63,1.24,6.35,6.97,0.62,5.57,0.77,0.93,0.62,0,0,0,4.64,1.39,1.08,1.24,1.08,0.31,4.33,9.44,0.77,10.53,2.01,4.49,4.02,1.55,3.25,0,0,0,0,1.55,0,0,0.46,1.08,0,31.11,6.81,8.36,0.31,0,0.62,0.93,0.46,1.24,2.48,9.6,0.31,325,"Violinist Sirena Huang gives a technically brilliant and emotionally nuanced performance. In a charming interlude, the 11-year-old praises the timeless design of her instrument.",1481,TED2006,1140652800,31,Sirena Huang,Sirena Huang: An 11-year-old's magical violin,1,1154995860,"[{'id': 1, 'name': 'Beautiful', 'count': 1671}, {'id': 9, 'name': 'Ingenious', 'count': 190}, {'id': 7, 'name': 'Funny', 'count': 190}, {'id': 11, 'name': 'Longwinded', 'count': 29}, {'id': 3, 'name': 'Courageous', 'count': 143}, {'id': 10, 'name': 'Inspiring', 'count': 879}, {'id': 22, 'name': 'Fascinating', 'count': 635}, {'id': 8, 'name': 'Informative', 'count': 22}, {'id': 2, 'name': 'Confusing', 'count': 10}, {'id': 23, 'name': 'Jaw-dropping', 'count': 2280}, {'id': 25, 'name': 'OK', 'count': 95}, {'id': 24, 'name': 'Persuasive', 'count': 41}, {'id': 26, 'name': 'Obnoxious', 'count': 39}, {'id': 21, 'name': 'Unconvincing', 'count': 15}]","[{'id': 2273, 'hero': 'https://pe.tedcdn.com/images/ted/ef5ead6c24bf79ac3417b3c7a10b4c08594e2bcc_2880x1620.jpg', 'speaker': 'Joey Alexander', 'title': 'An 11-year-old prodigy performs old-school jazz', 'duration': 388, 'slug': 'joey_alexander_an_11_year_old_prodigy_performs_old_school_jazz', 'viewed_count': 2155013}, {'id': 2242, 'hero': 'https://pe.tedcdn.com/images/ted/d8e551a456c32dfd2ba43b2c29135c246e7c5e74_2880x1620.jpg', 'speaker': 'Bill T. Jones', 'title': 'The dancer, the singer, the cellist ... and a moment of creative magic', 'duration': 386, 'slug': 'bill_t_jones_the_dancer_the_singer_the_cellist_and_a_moment_of_creative_magic', 'viewed_count': 1254866}, {'id': 1156, 'hero': 'https://pe.tedcdn.com/images/ted/1c53e6d17512a3a28f27cce961ea777ac5981d14_800x600.jpg', 'speaker': 'Robert Gupta + Joshua Roman', 'title': 'On violin and cello, ""Passacaglia""', 'duration': 561, 'slug': 'robert_gupta_and_joshua_roman_duet_on_passacaglia', 'viewed_count': 769922}, {'id': 805, 'hero': 'https://pe.tedcdn.com/images/ted/c9031a0735bdf47cf6af3667bd9ad3101ee1bd5b_1600x1200.jpg', 'speaker': 'Robert Gupta', 'title': 'Music is medicine, music is sanity', 'duration': 566, 'slug': 'robert_gupta', 'viewed_count': 1163379}, {'id': 1440, 'hero': 'https://pe.tedcdn.com/images/ted/a7cdfc92f9ccd377f01d953578c2a4bb6a4190b4_800x600.jpg', 'speaker': 'Michael Tilson Thomas', 'title': 'Music and emotion through time', 'duration': 1213, 'slug': 'michael_tilson_thomas_music_and_emotion_through_time', 'viewed_count': 1281071}, {'id': 2033, 'hero': 'https://pe.tedcdn.com/images/ted/37ac0f78df7d634eddc9d6d845a3b84f4441852f_2400x1800.jpg', 'speaker': 'Ge Wang', 'title': 'The DIY orchestra of the future', 'duration': 1056, 'slug': 'ge_wang_the_diy_orchestra_of_the_future', 'viewed_count': 1172280}]",Violinist,"['entertainment', 'music', 'performance', 'violin', 'wunderkind', 'youth']",An 11-year-old's magical violin,2702470
"(Music)(Music ends)(Applause)Thank you!(Applause continues)Thank you very much. Like the speaker before me — I am a TED virgin, I guess. I'm also the first time here, and ...(Laughter)I don't know what to say!(Applause)I'm really happy that Mr. Anderson invited me. I'm really grateful that I get a chance to play for everyone. And the song that I just played was by Josef Hofmann. It's called ""Kaleidoscope."" And Hofmann is a Polish pianist and composer of the late 19th century, and he's widely considered one of the greatest pianists of all time.I have another piece that I'd like to play for you. It's called ""Abegg Variations,"" by Robert Schumann, a German 19th-century composer. The name ""Abegg"" is actually A-B-E-G-G, and that's the main theme in the melody. (Plays the notes A, B, E, G and G) That comes from the last name of one of Schumann's female friends.(Laughter)But he wrote that for his wife.(Laughter)So actually, if you listen carefully, there are supposed to be five variations on this Abegg theme. It's written around 1834, so even though it's old, I hope you'll like it.(Music)(Music ends)(Applause)Now comes the part that I hate. Well, because Mr. Anderson told me that this session is called ""Sync and Flow,"" I was wondering, ""What do I know that these geniuses don't?""(Laughter)So, I'll talk about musical composition, even though I don't know where to start.How do I compose? I think Yamaha does a really good job of teaching us how to compose. What I do first is, I make a lot of little musical ideas you can just improvise here at the piano — and I choose one of those to become my main theme, my main melody, like the Abegg that you just heard. And once I choose my main theme, I have to decide: Out of all the styles in music, what kind of style do I want? And this year, I composed a Romantic style. So for inspiration, I listened to Liszt and Tchaikovsky and all the great Romantic composers.Next, I make the structure of the entire piece with my teachers. They help me plan out the whole piece. And then the hard part is filling it in with musical ideas, because then you have to think.(Laughter)And then, when the piece takes somewhat of a solified form — solidified, excuse me — solidified form, you're supposed to actually polish the piece, polish the details, and then polish the overall performance of the composition.And another thing that I enjoy doing is drawing. Drawing, because I like to draw, you know, Japanese anime art. I think that's a craze among teens right now. And once I realized it, there's a parallel between creating music and creating art, because for your motive, or your little initial idea for your drawing, it's your character — you want to decide who you want to draw, or if you want to draw an original character. And then you want to decide: How are you going to draw the character? Like, am I going to use one page? Am I going to draw it on the computer? Am I going to use a two-page spread like a comic book? For a more grandiose effect, I guess. And then you have to do the initial sketch of the character, which is like your structure of a piece, and then you add pen and pencil, and whatever details that you need — that's polishing the drawing.And another thing that both of these have in common is your state of mind, because I know I'm one of those teenagers that are really easily distracted. So if I'm trying to do homework and I don't feel like it, I'll try to draw or, you know, waste my time. And then what happens is, sometimes I absolutely can't draw or I can't compose at all, and then it's like there's too much on your mind. You can't focus on what you're supposed to do. And sometimes, if you manage to use your time wisely and work on it, you'll get something out of it, but it doesn't come naturally.What happens is, if something magical happens, if something natural happens to you, you're able to produce all this beautiful stuff instantly, and then that's what I consider ""flow,"" because that's when everything clicks and you're able to do anything. You feel like you're on top of your game and you can do anything you want.I'm not going to play my own composition today because, although I did finish it, it's way too long. Instead, I'd like to try something called ""improvisation."" I have here seven note cards, one with each note of the musical alphabet. And I'd like someone to come up here and choose five — anyone to come up here and choose five — and then I can make it into some sort of melody, and I'll improvise it. Wow. A volunteer, yay!(Laughter)(Applause)Jennifer Lin: Nice to meet you.Goldie Hawn: Thank you. Choose five?JL: Yes, five cards. Any five cards.GH: OK, one. JL: OK.GH: Two. JL: Yes.GH: Three.GH: Oh, D and F — too familiar.(Laughter)JL: One more. GH: OK. ""E"" for ""effort.""JL: Would you mind reading them out in the order that you chose them?GH: OK — C, G, B, A and E.JL: Thank you very much!GH: You're welcome. And what about these?JL: I won't use them. Thank you!(Applause)Now, she chose C, G, B, A, E. I'm going to try to put that in some sort of order.(Plays notes)OK, that's nice. So, I'm going to have a moment to think, and I'll try to make something out of it.(Plays the five notes)(Music)(Music ends)(Applause)The next song, or the encore that I'm going to play is called ""Bumble Boogie,"" by Jack Fina.(Applause)(Music)(Music ends)(Applause)","https://www.ted.com/talks/jennifer_lin_improvs_piano_magic
",1006,34.21,59.82,47.84,95.39,20.96,14.81,84,54.57,19.98,12.03,6.56,0.1,4.57,0.4,0.4,7.95,5.47,11.63,9.05,4.97,8.75,0.99,17.89,1.99,1.69,1.79,2.39,3.08,4.97,4.77,0.1,0,0.1,0,8.15,0.1,0.1,0.3,0.3,13.02,3.28,2.29,1.49,4.37,0.89,2.78,3.28,0.1,2.88,0.3,0.1,0,0,0.1,0,4.08,0.89,1.59,1.09,0.6,0.1,1.79,14.81,2.78,9.94,1.59,3.38,4.67,1.69,3.18,0.1,0,0,0,1.49,0,0.4,0.89,0.2,0,31.01,6.76,8.05,1.79,0,0.99,0.5,0.6,1.99,4.97,5.37,0,305,"Pianist and composer Jennifer Lin gives a magical performance, talks about the process of creativity and improvises a moving solo piece based on a random sequence of notes.",1445,TED2004,1077753600,32,Jennifer Lin,"Jennifer Lin: Improvising on piano, aged 14",1,1154995860,"[{'id': 1, 'name': 'Beautiful', 'count': 1107}, {'id': 3, 'name': 'Courageous', 'count': 85}, {'id': 9, 'name': 'Ingenious', 'count': 197}, {'id': 2, 'name': 'Confusing', 'count': 22}, {'id': 11, 'name': 'Longwinded', 'count': 35}, {'id': 10, 'name': 'Inspiring', 'count': 552}, {'id': 22, 'name': 'Fascinating', 'count': 454}, {'id': 21, 'name': 'Unconvincing', 'count': 53}, {'id': 23, 'name': 'Jaw-dropping', 'count': 1997}, {'id': 25, 'name': 'OK', 'count': 68}, {'id': 8, 'name': 'Informative', 'count': 32}, {'id': 24, 'name': 'Persuasive', 'count': 22}, {'id': 7, 'name': 'Funny', 'count': 24}, {'id': 26, 'name': 'Obnoxious', 'count': 31}]","[{'id': 2273, 'hero': 'https://pe.tedcdn.com/images/ted/ef5ead6c24bf79ac3417b3c7a10b4c08594e2bcc_2880x1620.jpg', 'speaker': 'Joey Alexander', 'title': 'An 11-year-old prodigy performs old-school jazz', 'duration': 388, 'slug': 'joey_alexander_an_11_year_old_prodigy_performs_old_school_jazz', 'viewed_count': 2155013}, {'id': 2100, 'hero': 'https://pe.tedcdn.com/images/ted/f0b2de54d5276e863d96cd736902cad23052e554_2880x1620.jpg', 'speaker': 'Daria van den Bercken', 'title': 'Why I take the piano on the road ... and in the air', 'duration': 570, 'slug': 'daria_van_den_bercken_why_i_take_the_piano_on_the_road_and_in_the_air', 'viewed_count': 903064}, {'id': 1298, 'hero': 'https://pe.tedcdn.com/images/ted/96fc3343d4c46540d40dc70ad8284275a31a4855_800x600.jpg', 'speaker': 'Stefon Harris', 'title': 'There are no mistakes on the bandstand', 'duration': 791, 'slug': 'stefon_harris_there_are_no_mistakes_on_the_bandstand', 'viewed_count': 653298}, {'id': 1526, 'hero': 'https://pe.tedcdn.com/images/ted/a5b96e266216cd84e407142eb2d06650aad5c40e_1200x900.jpg', 'speaker': 'Mark Applebaum', 'title': 'The mad scientist of music', 'duration': 1010, 'slug': 'mark_applebaum_the_mad_scientist_of_music', 'viewed_count': 3600566}, {'id': 883, 'hero': 'https://pe.tedcdn.com/images/ted/176929_800x600.jpg', 'speaker': 'David Byrne', 'title': 'How architecture helped music evolve', 'duration': 960, 'slug': 'david_byrne_how_architecture_helped_music_evolve', 'viewed_count': 1231154}, {'id': 246, 'hero': 'https://pe.tedcdn.com/images/ted/38589_480x360.jpg', 'speaker': 'Tod Machover + Dan Ellsey', 'title': 'Inventing instruments that unlock new music', 'duration': 1241, 'slug': 'tod_machover_and_dan_ellsey_play_new_music', 'viewed_count': 497153}]","Pianist, composer","['creativity', 'entertainment', 'music', 'performance', 'piano', 'wunderkind']","Improvising on piano, aged 14",1628912
"I'd like to begin this song I wrote about ceaseless yearning and never-ending want with a poem of popular Petrarchan paradoxes by Sir Thomas Wyatt the Elder: ""I find no peace, and all my war is done; I fear and hope, I burn and freeze like ice; I fly above the wind, and yet I cannot arise; And naught I have, and all the world I seize upon.""♫ I want what I can't have, need what I can't want ♫♫ Have what I don't have, what I want ♫♫ What I can't have, need what I can't want ♫♫ Have what I don't have, what I want ♫♫ What I can't have, need what I can't want ♫♫ Have what I don't have, what I want ♫♫ What I can't have, need what I can't want ♫♫ Have what I don't have, what I want ♫♫ What I can't have, need what I can't want ♫♫ Have but I don't have ♫♫ It feels like all I got is loss on a bad back ♫♫ Gone with the last train, honey don't you fret ♫♫ Every cloud has a silver lining ♫♫ Just a little rain, just a little rain, just a little rain ♫♫ I want what I can't have, need what I can't want ♫♫ Have what I don't have, what I want ♫♫ What I can't have, need what I can't want ♫♫ Have but I don't have ♫♫ My mind won't stop, and my heart says go ♫♫ Nobody knows how to hold me ♫♫ My mind won't stop, and my heart says, ♫♫ ""Good things come to those who wait"" ♫♫ And I can't stand in ... ♫♫ I can't stand in line forever ♫♫ Stand the cold air ♫♫ Glad-handed ♫♫ Sick and tired of the ""Later, maybe"" ♫♫ Take it, fake it, take it, take-it-or-leave-it life ♫♫ And I gotta just tame it ♫♫ I gotta just name it ♫♫ I gotta just seize, so please, oh please, oh please, oh please ♫♫ Oh please me right, 'cause ♫♫ My mind won't stop ♫♫ And my heart says go ♫♫ Nobody knows how to hold me ♫♫ My mind won't stop — and my heart says go-ooooo ... ♫♫ Good things must be here — yes, right here ♫♫ Here, right here, right here ♫♫ I won't live this life forever ♫♫ One time round is all the offer is ♫♫ Sick and tired of the ""Later, maybe"" ♫♫ Take it, fake it, make it, leave it life ♫♫ And I gotta just name it, I gotta just claim it ♫♫ I gotta just seize ♫♫ Oh please, oh please, oh please me right ♫♫ I want what I can't have, need what I can't want ♫♫ Have what I don't have, what I want ♫♫ What I can't have, need what I can't want ♫♫ Have but I don't have — you know that ♫♫ My mind won't stop, and my heart says go ♫♫ Nobody knows how to hold me, no ♫♫ My mind won't stop, and my heart says go ♫♫ 'Cause I want what I can't have, need what I can't want ♫♫ Have but I — have what I want ♫♫ What I can't have, need what I can't want ♫♫ What I can't have, need what I can't want ♫♫ Have but I don't have, what I want ♫♫ What I can't have, need what I can't want ♫♫ Have what I don't have, what I want ♫♫ What I can't have, need what I can't want ♫♫ Have but I don't have, what I want ♫♫ What I can't have, need what I can't want ♫♫ Have but I don't have what I want ♫(Applause)","https://www.ted.com/talks/nora_york_sings_what_i_want
",568,1,1,70.87,41.7,142,1.41,93.84,63.56,29.93,17.25,16.9,0,0.35,0,0,12.68,2.46,3.52,13.2,4.23,5.28,10.56,28.17,2.11,0.88,9.15,0.18,0.88,4.05,2.46,1.58,0.18,0.18,0.35,2.64,0,0.18,0,0.18,19.72,1.06,1.06,8.63,0.7,1.58,7.22,2.29,0.18,1.23,0.88,2.46,1.06,1.41,0,0,3.87,0,0.18,0.53,1.76,1.58,0.7,30.28,2.46,7.75,1.76,2.82,3.35,0.18,0.18,0,0,0,0.18,2.64,0,1.23,0.18,1.23,0,24.65,1.23,9.86,0.18,0.53,0,0,1.23,1.41,9.86,0.35,0,40,"Nora York gives a stunning performance of her song ""What I Want,"" with Jamie Lawrence (keyboards), Steve Tarshis (guitar) and Arthur Kell (bass).",276,TEDSalon 2006,1166054400,28,Nora York,"Nora York: Singing ""What I Want""",1,1175731860,"[{'id': 1, 'name': 'Beautiful', 'count': 123}, {'id': 3, 'name': 'Courageous', 'count': 22}, {'id': 21, 'name': 'Unconvincing', 'count': 20}, {'id': 9, 'name': 'Ingenious', 'count': 17}, {'id': 10, 'name': 'Inspiring', 'count': 71}, {'id': 8, 'name': 'Informative', 'count': 2}, {'id': 23, 'name': 'Jaw-dropping', 'count': 22}, {'id': 22, 'name': 'Fascinating', 'count': 38}, {'id': 24, 'name': 'Persuasive', 'count': 5}, {'id': 25, 'name': 'OK', 'count': 31}, {'id': 7, 'name': 'Funny', 'count': 11}, {'id': 2, 'name': 'Confusing', 'count': 7}, {'id': 26, 'name': 'Obnoxious', 'count': 13}, {'id': 11, 'name': 'Longwinded', 'count': 3}]","[{'id': 158, 'hero': 'https://pe.tedcdn.com/images/ted/b16a18dadf418183ae3941d28e21f6a68173f2c2_2880x1620.jpg', 'speaker': 'Vusi Mahlasela', 'title': '""Thula Mama""', 'duration': 606, 'slug': 'vusi_mahlasela_sings_thula_mama', 'viewed_count': 531957}, {'id': 110, 'hero': 'https://pe.tedcdn.com/images/ted/3376_480x360.jpg', 'speaker': 'Eddi Reader', 'title': '""Kiteflyer\'s Hill""', 'duration': 378, 'slug': 'eddi_reader_sings_kiteflyer_s_hill', 'viewed_count': 513672}, {'id': 117, 'hero': 'https://pe.tedcdn.com/images/ted/7087_480x360.jpg', 'speaker': 'Natalie MacMaster', 'title': 'Cape Breton fiddling in reel time', 'duration': 311, 'slug': 'natalie_macmaster_fiddles_in_reel_time', 'viewed_count': 717002}, {'id': 241, 'hero': 'https://pe.tedcdn.com/images/ted/36919_480x360.jpg', 'speaker': 'Jakob Trollback', 'title': 'A new kind of music video', 'duration': 240, 'slug': 'jakob_trollback_rethinks_the_music_video', 'viewed_count': 480377}, {'id': 298, 'hero': 'https://pe.tedcdn.com/images/ted/47347_480x360.jpg', 'speaker': 'Raul Midon', 'title': '""Peace on Earth""', 'duration': 559, 'slug': 'raul_midon_plays_everybody_and_peace_on_earth', 'viewed_count': 327540}, {'id': 2770, 'hero': 'https://pe.tedcdn.com/images/ted/ea594390cecc864357ebd75866ab69a68ea141f9_2880x1620.jpg', 'speaker': 'Serena Williams and Gayle King', 'title': 'On tennis, love and motherhood', 'duration': 1108, 'slug': 'serena_williams_gayle_king_on_tennis_love_and_motherhood', 'viewed_count': 1425473}]","Singer, performance artist","['entertainment', 'live music', 'music', 'performance', 'poetry', 'singer']","Singing ""What I Want""",395769
